{
  "$schema": "https://json-schema.org/draft/2020-12/schema",
  "$id": "https://github.com/mochan-tk/agentic-dev-kit-for-codex/blob/main/tests/conformance/catalog.schema.json",
  "title": "Canonical conformance scenario definitions",
  "type": "object",
  "additionalProperties": false,
  "required": [
    "schema",
    "source",
    "title",
    "scenario_count",
    "preamble_markdown",
    "families",
    "footer_markdown"
  ],
  "properties": {
    "schema": {
      "const": "conformance-catalog/v1"
    },
    "source": {
      "type": "object",
      "additionalProperties": false,
      "required": [
        "path",
        "sha256",
        "bytes",
        "lines"
      ],
      "properties": {
        "path": {
          "const": "tests/conformance/source/05_CONFORMANCE_SCENARIOS.md"
        },
        "sha256": {
          "type": "string",
          "pattern": "^[0-9a-f]{64}$"
        },
        "bytes": {
          "type": "integer",
          "minimum": 1
        },
        "lines": {
          "type": "integer",
          "minimum": 1
        }
      }
    },
    "title": {
      "type": "string",
      "minLength": 1
    },
    "scenario_count": {
      "const": 136
    },
    "preamble_markdown": {
      "type": "string",
      "minLength": 1
    },
    "families": {
      "type": "array",
      "minItems": 14,
      "maxItems": 14,
      "items": {
        "type": "object",
        "additionalProperties": false,
        "required": [
          "id",
          "source_order",
          "title",
          "source_heading_markdown",
          "scenarios"
        ],
        "properties": {
          "id": {
            "enum": [
              "C",
              "A",
              "S",
              "R",
              "E",
              "H",
              "W",
              "T",
              "O",
              "I",
              "G",
              "P",
              "D",
              "X"
            ]
          },
          "source_order": {
            "type": "integer",
            "minimum": 1
          },
          "title": {
            "type": "string",
            "minLength": 1
          },
          "source_heading_markdown": {
            "type": "string",
            "minLength": 1
          },
          "scenarios": {
            "type": "array",
            "minItems": 1,
            "items": {
              "type": "object",
              "additionalProperties": false,
              "required": [
                "id",
                "source_order",
                "title",
                "source_body_markdown",
                "expected"
              ],
              "properties": {
                "id": {
                  "type": "string",
                  "pattern": "^[A-Z]-[0-9]{3}$"
                },
                "source_order": {
                  "type": "integer",
                  "minimum": 1
                },
                "title": {
                  "type": "string",
                  "minLength": 1
                },
                "source_body_markdown": {
                  "type": "string",
                  "minLength": 1
                },
                "precondition": {
                  "type": "string",
                  "minLength": 1
                },
                "action": {
                  "type": "string",
                  "minLength": 1
                },
                "expected": {
                  "type": "object",
                  "additionalProperties": false,
                  "required": [
                    "label",
                    "text"
                  ],
                  "properties": {
                    "label": {
                      "enum": [
                        "Expected",
                        "Expected target behavior"
                      ]
                    },
                    "text": {
                      "type": "string",
                      "minLength": 1
                    }
                  }
                }
              }
            }
          }
        }
      }
    },
    "footer_markdown": {
      "type": "string",
      "minLength": 1
    }
  }
}
