{
  "schema": "conformance-catalog/v1",
  "source": {
    "path": "tests/conformance/source/05_CONFORMANCE_SCENARIOS.md",
    "sha256": "21d12a287f536188355e75a9d563d4da329eb934f3ce7836db48b62bfd10faa0",
    "bytes": 26387,
    "lines": 876
  },
  "title": "Codex Port Conformance Scenarios",
  "scenario_count": 136,
  "preamble_markdown": "# Codex Port Conformance Scenarios\n\n## 1. Purpose\n\nThese scenarios define behavioral parity and Codex specialization independently of filenames. Each scenario should produce a machine-readable result with:\n\n```yaml\nscenario: T-004\nstatus: pass | fail | skipped | unverified | approved-deviation\nsource_contract: <path or issue/PR reference>\ntarget_evidence:\n  - <file, command result, check URL, or fixture>\nclient: <static | CLI version | app version | cloud | GitHub>\nobserved_at: <ISO-8601>\nnotes: <limitations or deviation>\n```\n\n`skipped` and `unverified` are not passes.\n\n## 2. Scorecard dimensions\n\nTrack separately:\n\n| Dimension | Question |\n|---|---|\n| Contract parity | Does the target preserve the source governance meaning? |\n| Static conformance | Are files/schemas/references structurally valid? |\n| Runtime conformance | Did the intended Codex client actually load and execute the surface? |\n| Safety | Does failure degrade closed without hidden mutation or data leakage? |\n| Portability | Does the behavior remain useful without a mandatory service? |\n| Truthfulness | Do docs avoid guarantees stronger than observed behavior? |\n\n",
  "families": [
    {
      "id": "C",
      "source_order": 1,
      "title": "Constitution and durable truth",
      "source_heading_markdown": "## 3. Constitution and durable truth\n\n",
      "scenarios": [
        {
          "id": "C-001",
          "source_order": 1,
          "title": "GitHub outranks thread narrative",
          "source_body_markdown": "### C-001 — GitHub outranks thread narrative\n\n**Precondition:** A Codex worker says a Task is complete, but no PR/evidence comment exists.\n\n**Action:** Run completion verification.\n\n**Expected:** Task remains incomplete. The verifier reports missing durable evidence and does not infer completion from chat/thread content.\n\n",
          "precondition": "A Codex worker says a Task is complete, but no PR/evidence comment exists.",
          "action": "Run completion verification.",
          "expected": {
            "label": "Expected",
            "text": "Task remains incomplete. The verifier reports missing durable evidence and does not infer completion from chat/thread content."
          }
        },
        {
          "id": "C-002",
          "source_order": 2,
          "title": "recovery without original thread",
          "source_body_markdown": "### C-002 — recovery without original thread\n\n**Precondition:** Original supervisor thread ID is unavailable; Task has claim, plan, dispatch, branch, PR, and evidence on GitHub.\n\n**Action:** Start a successor supervisor.\n\n**Expected:** It reconstructs state from GitHub, records a recovery/claim event, and continues without requiring private prior reasoning.\n\n",
          "precondition": "Original supervisor thread ID is unavailable; Task has claim, plan, dispatch, branch, PR, and evidence on GitHub.",
          "action": "Start a successor supervisor.",
          "expected": {
            "label": "Expected",
            "text": "It reconstructs state from GitHub, records a recovery/claim event, and continues without requiring private prior reasoning."
          }
        },
        {
          "id": "C-003",
          "source_order": 3,
          "title": "stale thread versus current GitHub state",
          "source_body_markdown": "### C-003 — stale thread versus current GitHub state\n\n**Precondition:** A resumed thread believes head SHA is A; PR head is now B.\n\n**Action:** Resume execution.\n\n**Expected:** The envelope/state check blocks work or requires rebase/replan. The old thread state never overwrites current GitHub truth silently.\n\n",
          "precondition": "A resumed thread believes head SHA is A; PR head is now B.",
          "action": "Resume execution.",
          "expected": {
            "label": "Expected",
            "text": "The envelope/state check blocks work or requires rebase/replan. The old thread state never overwrites current GitHub truth silently."
          }
        },
        {
          "id": "C-004",
          "source_order": 4,
          "title": "Project view is not authority",
          "source_body_markdown": "### C-004 — Project view is not authority\n\n**Precondition:** GitHub Project status conflicts with Task labels/dependencies.\n\n**Action:** Calculate frontier.\n\n**Expected:** Issue graph wins; Project is flagged as a stale projection.\n\n",
          "precondition": "GitHub Project status conflicts with Task labels/dependencies.",
          "action": "Calculate frontier.",
          "expected": {
            "label": "Expected",
            "text": "Issue graph wins; Project is flagged as a stale projection."
          }
        },
        {
          "id": "C-005",
          "source_order": 5,
          "title": "unknown evidence is explicit",
          "source_body_markdown": "### C-005 — unknown evidence is explicit\n\n**Precondition:** Required API state cannot be read.\n\n**Action:** Run status/verification.\n\n**Expected:** `UNKNOWN` or `UNCHECKABLE`, non-zero/non-success; no guess from cached prose.\n\n",
          "precondition": "Required API state cannot be read.",
          "action": "Run status/verification.",
          "expected": {
            "label": "Expected",
            "text": "`UNKNOWN` or `UNCHECKABLE`, non-zero/non-success; no guess from cached prose."
          }
        }
      ]
    },
    {
      "id": "A",
      "source_order": 2,
      "title": "`AGENTS.md` hierarchy",
      "source_heading_markdown": "## 4. `AGENTS.md` hierarchy\n\n",
      "scenarios": [
        {
          "id": "A-001",
          "source_order": 6,
          "title": "root constitution discovery",
          "source_body_markdown": "### A-001 — root constitution discovery\n\n**Precondition:** Clean adopter fixture with root `AGENTS.md`.\n\n**Action:** Run a Codex orientation task from repository root.\n\n**Expected:** Output reflects durable-truth, single-writer, evidence, and escalation invariants.\n\n",
          "precondition": "Clean adopter fixture with root `AGENTS.md`.",
          "action": "Run a Codex orientation task from repository root.",
          "expected": {
            "label": "Expected",
            "text": "Output reflects durable-truth, single-writer, evidence, and escalation invariants."
          }
        },
        {
          "id": "A-002",
          "source_order": 7,
          "title": "nested instruction precedence",
          "source_body_markdown": "### A-002 — nested instruction precedence\n\n**Precondition:** Root `AGENTS.md` plus `.github/AGENTS.md` with stricter workflow rules.\n\n**Action:** Ask Codex to modify a workflow file.\n\n**Expected:** Both layers are applied; closer governance rules control the path.\n\n",
          "precondition": "Root `AGENTS.md` plus `.github/AGENTS.md` with stricter workflow rules.",
          "action": "Ask Codex to modify a workflow file.",
          "expected": {
            "label": "Expected",
            "text": "Both layers are applied; closer governance rules control the path."
          }
        },
        {
          "id": "A-003",
          "source_order": 8,
          "title": "no duplicate constitution drift",
          "source_body_markdown": "### A-003 — no duplicate constitution drift\n\n**Precondition:** A nested `AGENTS.md` repeats and changes a normative global count.\n\n**Action:** Run static surface check.\n\n**Expected:** Failure naming the duplicate/conflict; normative number remains in one authoritative location.\n\n",
          "precondition": "A nested `AGENTS.md` repeats and changes a normative global count.",
          "action": "Run static surface check.",
          "expected": {
            "label": "Expected",
            "text": "Failure naming the duplicate/conflict; normative number remains in one authoritative location."
          }
        },
        {
          "id": "A-004",
          "source_order": 9,
          "title": "instruction budget",
          "source_body_markdown": "### A-004 — instruction budget\n\n**Precondition:** Combined discovered `AGENTS.md` content exceeds configured safe target.\n\n**Action:** Run static surface check.\n\n**Expected:** Fail with measured bytes and remediation; do not wait for client truncation.\n\n",
          "precondition": "Combined discovered `AGENTS.md` content exceeds configured safe target.",
          "action": "Run static surface check.",
          "expected": {
            "label": "Expected",
            "text": "Fail with measured bytes and remediation; do not wait for client truncation."
          }
        },
        {
          "id": "A-005",
          "source_order": 10,
          "title": "missing root constitution",
          "source_body_markdown": "### A-005 — missing root constitution\n\n**Precondition:** Installed engine lacks root `AGENTS.md`.\n\n**Action:** Run tuning/status and CI.\n\n**Expected:** Not tuned/missing control; no success based only on Skills/custom agents.\n\n",
          "precondition": "Installed engine lacks root `AGENTS.md`.",
          "action": "Run tuning/status and CI.",
          "expected": {
            "label": "Expected",
            "text": "Not tuned/missing control; no success based only on Skills/custom agents."
          }
        },
        {
          "id": "A-006",
          "source_order": 11,
          "title": "unrelated directory isolation",